{
  "$schema": "https://json-schema.org/draft/2020-12/schema",
  "$id": "https://think-fast.local/contracts/v1/event.schema.json",
  "title": "RealtimeEvent",
  "type": "object",
  "additionalProperties": false,
  "required": ["type", "version", "sequence", "occurred_at", "visibility", "payload"],
  "anyOf": [{"required": ["match_id"]}, {"required": ["room_id"]}],
  "properties": {
    "type": {
      "enum": [
        "room.player_joined", "room.player_left", "room.ready_changed", "room.rules_changed",
        "challenge.setup_started", "challenge.committed", "challenge.setup_progress",
        "challenge.setup_cancelled", "match.countdown_started", "match.started", "guess.evaluated",
        "opponent.guessed", "participant.solved", "player.solved", "participant.disconnected",
        "participant.reconnected", "round.created", "round.started", "round.finished",
        "creator.selected", "creator.rotated", "scores.updated",
        "match.finished", "rematch.requested",
        "rematch.accepted", "rematch.declined", "rematch.expired",
        "system.resync_required"
      ]
    },
    "version": {"const": 1},
    "match_id": {"type": "string", "format": "uuid"},
    "room_id": {"type": "string", "format": "uuid"},
    "sequence": {"type": "integer", "minimum": 1},
    "occurred_at": {"type": "string", "format": "date-time"},
    "visibility": {"enum": ["room", "match", "participant", "connection"]},
    "payload": {"type": "object"}
  },
  "allOf": [
    {
      "if": {"properties": {"type": {"const": "opponent.guessed"}}},
      "then": {
        "properties": {
          "visibility": {"const": "match"},
          "payload": {
            "type": "object",
            "additionalProperties": false,
            "required": ["participant_id", "attempt_count"],
            "properties": {
              "participant_id": {"type": "string", "format": "uuid"},
              "attempt_count": {"type": "integer", "minimum": 1},
              "round_number": {"type": "integer", "minimum": 1}
            }
          }
        }
      }
    },
    {
      "if": {"properties": {"type": {"const": "guess.evaluated"}}},
      "then": {
        "properties": {
          "visibility": {"const": "participant"},
          "payload": {
            "type": "object",
            "additionalProperties": false,
            "required": ["participant_id", "attempt_id", "ordinal", "feedback", "solved"],
            "properties": {
              "participant_id": {"type": "string", "format": "uuid"},
              "attempt_id": {"type": "string", "format": "uuid"},
              "ordinal": {"type": "integer", "minimum": 1},
              "feedback": {"$ref": "feedback.schema.json"},
              "solved": {"type": "boolean"},
              "round_number": {"type": "integer", "minimum": 1}
            }
          }
        }
      }
    },
    {
      "if": {"properties": {"type": {"const": "round.finished"}}},
      "then": {
        "properties": {
          "visibility": {"const": "match"},
          "payload": {
            "type": "object",
            "additionalProperties": false,
            "required": ["round_number", "total_rounds", "reason", "solvers", "creator", "revealed_secret", "scores"],
            "properties": {
              "round_number": {"type": "integer", "minimum": 1},
              "total_rounds": {"type": "integer", "minimum": 1},
              "reason": {"enum": ["all_solved", "deadline"]},
              "solvers": {
                "type": "array",
                "items": {
                  "type": "object",
                  "additionalProperties": false,
                  "required": ["participant_id", "display_name", "attempt_count", "solve_duration_ms"],
                  "properties": {
                    "participant_id": {"type": "string", "format": "uuid"},
                    "display_name": {"type": "string", "minLength": 1, "maxLength": 20},
                    "attempt_count": {"type": "integer", "minimum": 1},
                    "solve_duration_ms": {"type": "integer", "minimum": 0}
                  }
                }
              },
              "creator": {
                "oneOf": [
                  {"type": "null"},
                  {
                    "type": "object",
                    "additionalProperties": false,
                    "required": ["participant_id", "display_name"],
                    "properties": {
                      "participant_id": {"type": "string", "format": "uuid"},
                      "display_name": {"type": "string", "minLength": 1, "maxLength": 20}
                    }
                  }
                ]
              },
              "revealed_secret": {
                "oneOf": [
                  {"type": "string", "pattern": "^[0-9]{5,6}$"},
                  {"type": "array", "minItems": 5, "maxItems": 8, "items": {"type": "string"}}
                ]
              },
              "scores": {"type": "object", "additionalProperties": {"type": "integer", "minimum": 0}}
            }
          }
        }
      }
    }
  ]
}
