{
  "type": "guess.evaluated",
  "version": 1,
  "match_id": "1d4a1b27-795b-4ddf-9c9b-b47ebf11b648",
  "sequence": 4,
  "occurred_at": "2026-08-26T12:00:00Z",
  "visibility": "participant",
  "payload": {
    "participant_id": "85828209-75c5-426f-8d6f-f42af238b3da",
    "attempt_id": "a460ac5e-23a2-485f-8cb8-d344dc9f6ca0",
    "ordinal": 1,
    "feedback": {"kind": "exact_count", "exact_count": 2},
    "solved": false
  }
}
