{
  "type": "round.finished",
  "version": 1,
  "match_id": "54fd9228-bb06-418a-bc77-a08f806c3666",
  "sequence": 19,
  "occurred_at": "2026-09-18T10:03:00Z",
  "visibility": "match",
  "payload": {
    "round_number": 2,
    "total_rounds": 5,
    "reason": "all_solved",
    "solvers": [
      {
        "participant_id": "16170fa3-f6ea-4fdf-8851-d3c9d2ad6666",
        "display_name": "Mina",
        "attempt_count": 3,
        "solve_duration_ms": 42000
      }
    ],
    "creator": {
      "participant_id": "a191b028-2672-420b-af19-67c922e86666",
      "display_name": "Sara"
    },
    "revealed_secret": "58321",
    "scores": {
      "a191b028-2672-420b-af19-67c922e86666": 2,
      "16170fa3-f6ea-4fdf-8851-d3c9d2ad6666": 7,
      "f807e9db-5896-464f-803c-16b4627a6666": 3
    }
  }
}
